request_id,mode,rank,score,hit_category,hit_source,hit_id,snippet,highlight
10,knn,8,0.80848706,soccer,hamstring_injuries_in_athletes_a_current_approach_to_the_diagnosis_and_treatment.pdf,3211,"1. Lempainen, L., et al., Distal tears of the hamstring muscles: review of the literature and our results of surgical tr",
10,knn,9,0.8055661,soccer,hamstring_injuries_in_athletes_a_current_approach_to_the_diagnosis_and_treatment.pdf,3191,"Muscle injuries are the most frequent traumas occurring in sports, and among those, the hamstrings are the most commonly",
10,knn,10,0.8026183,soccer,hamstring_injuries_in_athletes_a_current_approach_to_the_diagnosis_and_treatment.pdf,3195,Risk factors for hamstring can be categorized as modifiable and nonmodifiable. Modifiable risk factors include inadequat,
10,hybrid,1,37.740623,soccer,hamstring_injuries_in_athletes_a_current_approach_to_the_diagnosis_and_treatment.pdf,3196,"The clinical presentation of a hamstring injury may vary depending on the grade, location, and mechanism of injury. An a","<em>The</em> clinical presentation <em>of</em> <em>a</em> <em>hamstring</em> injury may vary depending <em>on</em> <em>the</em> grade, location, <em>and</em> mechanism"
10,hybrid,2,32.38326,soccer,52836.pdf,3431,"Mechanism of Injury Ankle sprains occur when the ligaments surrounding the ankle are stretched or torn, often due to sud",", often due <em>to</em> <em>sudden</em> changes <em>in</em> direction, uneven surfaces, <em>or</em> direct contact with another player ."
10,hybrid,3,30.60281,running,Knee pain and other running injuries - NHS.pdf,2157,"To treat achilles pain at home, apply wrapped up ice to the area if you can feel a lump there (never put ice directly on","<em>To</em> treat achilles <em>pain</em> at home, apply wrapped up ice <em>to</em> <em>the</em> area <em>if</em> you can feel <em>a</em> lump there (never"
10,hybrid,4,28.182003,running,Knee pain and other running injuries - NHS.pdf,2158,"A sharp pain will stop you running altogether. Even if the pain is not severe, it's a good idea to rest until the pain g",<em>A</em> <em>sharp</em> <em>pain</em> will stop you <em>running</em> altogether.
10,hybrid,5,28.067566,soccer,sports-12-00134-v2.pdf,3046,"When a player sprints, the activation caused in the hamstrings (level and timing), is very different from the strengthen",greater than <em>the</em> activation <em>experienced</em> by <em>the</em> rest <em>of</em> <em>the</em> <em>hamstring</em> muscles involved .
10,hybrid,6,27.755632,running,Knee pain and other running injuries - NHS.pdf,2156,"You may have pain and swelling at the back of the ankle or heel. The pain may be minor but continuous, or it could be su",You may have <em>pain</em> <em>and</em> swelling at <em>the</em> <em>back</em> <em>of</em> <em>the</em> ankle <em>or</em> heel.
10,hybrid,7,27.545256,running,return-to-running.pdf,2259,- Running Warmup: A dynamic warmup and 3-5-minute walk should precede each run - Running Frequency: - Every other day (i,- <em>Running</em> Warmup: <em>A</em> dynamic warmup <em>and</em> 3-5-minute walk should precede each run - <em>Running</em> Frequency: -
10,hybrid,8,27.263205,running,Knee pain and other running injuries - NHS.pdf,2154,"Do not run if you have pain in your knee. If you still feel pain after a week's rest, see a GP or physiotherapist. How s",Do <em>not</em> run <em>if</em> you have <em>pain</em> <em>in</em> your knee.
10,hybrid,9,26.075954,running,Knee pain and other running injuries - NHS.pdf,2169,You will not be able to run with a muscle strain. The time it takes for a strain to heal and for you to start running ag,You will <em>not</em> be able <em>to</em> run with <em>a</em> muscle <em>strain</em>.
10,hybrid,10,26.036217,running,Knee pain and other running injuries - NHS.pdf,2167,The pain of a muscle strain is often sudden and feels as if someone has kicked you in the area of your calf or hamstring,<em>The</em> <em>pain</em> <em>of</em> <em>a</em> muscle <em>strain</em> is often <em>sudden</em> <em>and</em> feels as <em>if</em> someone has kicked you <em>in</em> <em>the</em> area <em>of</em> your
11,hybrid,1,39.27853,badminton,badminton-related-musculoskeletal-injuries-in-senior-players-epidemiology-and-preventive-strategies-15917.pdf,51,"strong and coordinated muscle activation across the hip, knee, and ankle joints stabilizes these areas and absorbs impac","stability, and proper ankle positioning during landing <em>to</em> <em>reduce</em> <em>injury</em> risks."
11,hybrid,2,39.022305,badminton,5673-17122-1-PB.pdf,383,Implementation of a Structured Warm-up and Cool-down Programme: A thorough warm-up before training or competition and an,Implementation of a Structured <em>Warm</em>-<em>up</em> and Cool-down Programme: A thorough <em>warm</em>-<em>up</em> <em>before</em> training <em>or</em>
11,hybrid,3,37.608036,soccer,Pre-Warm Up Activation & Injury Reduction in Soccer.pdf,3599,"Applying an injury prevention strategy is something that cannot be described in one article such as this, as the goal fo",", as <em>the</em> goal for every club should be <em>to</em> build a philosophy based on <em>each</em> <em>football</em> athlete's individual"
11,hybrid,4,36.623726,badminton,How Physiotherapy Helps With Badminton Injuries.pdf,168,"Achilles tendonitis is an overuse injury that affects the Achilles tendon, which links the calf muscles to the heel bone",An ultrasound <em>or</em> MRI <em>can</em> help determine <em>the</em> severity of <em>the</em> <em>injury</em>.
11,hybrid,5,35.770954,badminton,#1 Injury Prevention Tips for Badminton.pdf,345,"For beginners, some of the most effective badminton injury prevention tips are: 1. Learn good footwork and racket grip 2","For beginners, some of <em>the</em> <em>most</em> <em>effective</em> badminton <em>injury</em> prevention tips <em>are</em>: 1."
11,hybrid,6,33.219967,badminton,Common Badminton Injuries and Their Preventions.pdf,399,include: exercises Mobility to improve exercises Flexibility exercises Cross-training to prevent Education on warming Wh,on warming When motion range of Women's muscular <em>up</em> cooling and <em>to</em> treatment Health <em>the</em> Knee <em>The</em> affected
11,hybrid,7,32.58771,soccer,577.full.pdf,4056,The ef /uni FB01 cacy of FIFA 11+ was /uni FB01 rst proven in young female players 2 5 as was the Prevent and Enhance Pe,"<em>to</em> 50%) of injuries in female players aged 13 -18 in large RCTs, when <em>the</em> <em>warm</em> <em>up</em> <em>exercises</em> were performed"
11,hybrid,8,32.29148,soccer,jcm-14-01714.pdf,4028,Other types of neuromuscular training were also evaluated. Emery and Meeuwisse compared the efficacy of a standardized w,Emery and Meeuwisse compared <em>the</em> efficacy of a standardized <em>warm</em>-<em>up</em> program with a 15 min duration versus
11,hybrid,9,31.935656,soccer,jcm-14-01714.pdf,4016,The growing concern regarding injury prevalence in soccer has prompted extensive research into preventive measures. Amon,<em>reduce</em> <em>injury</em> <em>risk</em>.
11,hybrid,10,31.36929,soccer,Soccer Warm-Up Drills for Coaches_ Enhance Player Readiness.pdf,2840,"Soccer-specific warm-up strategies are a cornerstone of player preparation, blending science and practice to optimize pe","Soccer-specific <em>warm</em>-<em>up</em> strategies <em>are</em> a cornerstone of player preparation, blending science and practice"
12,knn,1,0.8128898,soccer,ijerph-19-13237.pdf,3785,"| Ehrmann et al., 2016 | N=19, mean age: 25.7 5.1 years, Australian League team | Retrospective study, 1 season | Time-l",
12,knn,2,0.8080873,soccer,ijerph-19-13237.pdf,3808,"As a team-based sport, the training and competition loads of soccer are uniformly arranged, but the application of the s",
12,knn,3,0.8069213,soccer,ijerph-19-13237.pdf,3796,"Over the past 10 years, GPS and accelerometer technologies have become the main external load-monitoring tools for team ",
12,knn,4,0.7937561,soccer,s40798-020-00296-1.pdf,2803,"One high-quality study evaluated the association between the duration of training and matches (over the preceding week, ",
12,knn,5,0.79324245,soccer,ijerph-19-13237.pdf,3798,"For the number of accelerations in training, the greatest risk of contact injury occurs when there is an ACWR (1:4) &gt;",
12,knn,6,0.79300547,soccer,sports-12-00134-v2.pdf,3066,"In our case, being aware that the sprint can have risky and adverse e ff ects if we measure retrospectively, we must try",
12,knn,7,0.7906526,soccer,ijerph-19-13237.pdf,3782,"| Author, Time | Participants | Follow-Up | Injury Definition | Results | |-------------------------|-------------------",
12,knn,8,0.7886721,soccer,e001461.full.pdf,4373,Surveillance with correction of conduction of training/ exercise execution was included as one of seven preventative mea,
12,knn,9,0.7883993,soccer,ijerph-19-13237.pdf,3761,"With the development of commercialization and professionalism in soccer, the professional leagues in many countries have",
12,knn,10,0.7863324,soccer,00007256-200434130-00004.pdf,3383,"About 20 years ago, Ekstrand et al. evaluated an injury prevention programme in male senior division players. Six out of",
12,hybrid,1,25.603224,soccer,sports-12-00134-v2.pdf,3044,"In sprinting, we are faced with a reality where, on the one hand, the player needs to be able to perform actions at a ve","actions <em>at</em> a very high speed during matches, and on the other hand, this type <em>of</em> effort increase the"
12,hybrid,2,24.034204,soccer,ijerph-19-13237.pdf,3796,"Over the past 10 years, GPS and accelerometer technologies have become the main external load-monitoring tools for team ","sports, and <em>can</em> objectively and accurately quantify the distance and speed <em>of</em> <em>training</em> and competition"
12,hybrid,3,21.87652,soccer,ijerph-19-13237.pdf,3785,"| Ehrmann et al., 2016 | N=19, mean age: 25.7 5.1 years, Australian League team | Retrospective study, 1 season | Time-l",", 1 season | Time-loss injuries | <em>Players</em> performed significantly <em>higher</em> meters per minute in the weeks"
12,hybrid,4,21.705288,soccer,e001461.full.pdf,4372,The greatest difference between the HIGH and LOW groups was the opinion on the leadership style of coaches. This is a pr,<em>Our</em> basic hypothesis is that the coaches <em>are</em> the most important persons for the <em>injury</em> situation in an
12,hybrid,5,21.397543,soccer,Pre-Warm Up Activation & Injury Reduction in Soccer.pdf,3598,Scientific literature has demonstrated that there are clear relationships between squad injury rates and overall team pe,Scientific literature has demonstrated that there <em>are</em> clear relationships between squad <em>injury</em> rates
12,hybrid,6,21.150139,swimming,i1062-6050-55-1-32.pdf,5463,"However, despite similar or even higher volumes reported in adult swimmers, results in this age group varied. This discr",This discrepancy in evidence across the life span <em>of</em> the swimmer <em>can</em> be supported with the <em>recently</em> introduced
12,hybrid,7,20.741753,soccer,e001461.full.pdf,4370,This study on modifiable risk factors for hamstring injury among professional football players revealed that CMOs from e,This study on modifiable <em>risk</em> factors for hamstring <em>injury</em> among professional <em>football</em> <em>players</em> revealed
12,hybrid,8,20.471321,soccer,How to prevent common exercise injuries.pdf,4119,"14. Ingraham. Proprioception, the True Sixth Sense: The vital and strange sensation of position, movement, and effort. P",Proprioceptive <em>Training</em> and <em>Injury</em> Prevention in a Professional Men's Basketball <em>Team</em>: A Six-Year Prospective
12,hybrid,9,20.162592,soccer,s40798-020-00296-1.pdf,2736,Implementing an optimal training load in elite youth soccer training programs is of utmost importance to reduce the risk,<em>Training</em> load <em>can</em> be categorized into two components.
12,hybrid,10,20.050093,soccer,ijerph-19-13237.pdf,3808,"As a team-based sport, the training and competition loads of soccer are uniformly arranged, but the application of the s","As a <em>team</em>-based sport, the <em>training</em> and competition loads <em>of</em> soccer <em>are</em> uniformly arranged, but the application"
13,knn,1,0.8653637,swimming,s40798-016-0051-2.pdf,5519,Shoulder Rehabilitation Changes in training practices and improved research allow healthcare providers to manage shoulde,
13,knn,2,0.8597897,swimming,10.1177_1941738110377611.pdf,5484,Keywords: swimmer's shoulder; swim strokes; biomechanics C ompetitive swimming has become an increasingly popular sport ,
13,knn,3,0.8591524,swimming,s40798-016-0051-2.pdf,5515,Swimmers often do weight lifting and other ' dryland training ' as part of their training program. Acute musculoskeletal,
13,knn,4,0.8538188,swimming,10.1177_1941738110377611.pdf,5499,The painful swimmer's shoulder should be considered in the context of the entire kinetic chain. This approach allows ide,
13,knn,5,0.85334015,swimming,10.1177_1941738112442132.pdf,4348,Musculoskeletal overuse injuries are a common source of pain in competitive swimmers. Correct stroke technique may help ,
13,knn,6,0.85235524,swimming,s40798-016-0051-2.pdf,5516,<!-- image --> aware of physiologic stressors and biomechanics during the swim stroke similar to how we have come to und,
13,knn,7,0.85113627,swimming,10.1177_1941738114527056.pdf,4810,"Stroke errors are potential risk factors for shoulder pain in competitive swimmers. 4,8,14,15 Swimmers are subject to sh",
13,knn,8,0.8498621,swimming,10.1177_1941738110377611.pdf,5483,"Scott A. Heinlein, PT,  and Andrew J. Cosgarea, MD Context: Competitive swimming has become an increasingly popular spor",
13,knn,9,0.8490997,swimming,90282-sink-or-swim-clinical-objective-tests-and-measures-associated-with-shoulder-pain-in-swimmers-of-varied-age-levels-of-competition-a-systematic-revi.pdf,5181,"Shoulder pain in swimmers has consistently been noted to interfere with swimming training and competition. In 1993, Mc M",
13,knn,10,0.84568775,swimming,Injuries_in_swimming_sports_prevention_and_treatme.pdf,5406,Musculoskeletal pain caused by heavy training from swimming is very common. Proper swimming techniques can prevent injur,
13,hybrid,1,24.340271,swimming,10.1177_1941738114527056.pdf,4810,"Stroke errors are potential risk factors for shoulder pain in competitive swimmers. 4,8,14,15 Swimmers are subject to sh","<em>Stroke</em> errors are potential risk factors for <em>shoulder</em> <em>pain</em> <em>in</em> competitive <em>swimmers</em>. 4,8,14,15 <em>Swimmers</em>"
13,hybrid,2,23.37177,badminton,Common Badminton Injuries and Their Preventions.pdf,390,' essential s It make that symptoms elbow badminton include: injuries EXPLORE ARTICLES BY BODY PARTS EXPLORE ARTICLES BY,' essential s <em>It</em> <em>make</em> that symptoms elbow badminton include: injuries EXPLORE ARTICLES BY BODY PARTS
13,hybrid,3,22.008171,swimming,ijspt-10-712.pdf,4654,"To familiarize the clinician with the swimming culture, a vocabulary of common terminology has been The criterion to beg",free <em>in</em> the <em>shoulder</em> complex <em>and</em> 2) full active extension <em>and</em> external rotation of the glenohumeral
13,hybrid,4,21.11945,swimming,Injuries_in_swimming_sports_prevention_and_treatme.pdf,5399,"Studies have shown that shoulder injuries are inevitable in elite performance, regardless of young or adult swimmers (Ka","Studies have shown that <em>shoulder</em> injuries are inevitable <em>in</em> elite performance, regardless of young <em>or</em>"
13,hybrid,5,21.09756,swimming,10.1177_1941738112442132.pdf,4348,Musculoskeletal overuse injuries are a common source of pain in competitive swimmers. Correct stroke technique may help ,Musculoskeletal overuse injuries are a common source of <em>pain</em> <em>in</em> competitive <em>swimmers</em>.
13,hybrid,6,21.016968,badminton,Common Badminton Injuries and Their Preventions.pdf,388,- What are the common injuries in badminton and how can they be prevented? - Badminton Injury Prevention &amp; Rehabilit,- <em>What</em> are the common injuries <em>in</em> badminton <em>and</em> <em>how</em> <em>can</em> they be prevented?
13,hybrid,7,20.50411,swimming,s40798-016-0051-2.pdf,5519,Shoulder Rehabilitation Changes in training practices and improved research allow healthcare providers to manage shoulde,<em>Shoulder</em> Rehabilitation Changes <em>in</em> training practices <em>and</em> improved research allow healthcare providers
13,hybrid,8,20.353197,swimming,90282-sink-or-swim-clinical-objective-tests-and-measures-associated-with-shoulder-pain-in-swimmers-of-varied-age-levels-of-competition-a-systematic-revi.pdf,5182,"In order to provide appropriate rehabilitation, knowledge of the factors associated with shoulder pain and injury is imp","Extrinsic variables include number of years of swum 4,8 prior history of <em>shoulder</em> <em>pain</em> <em>or</em> injury, 3,9,10"
13,hybrid,9,20.199955,running,Patellofemoral Pain Syndrome (PFPS)_ Symptoms & Treatment.pdf,2187,"PFPS usually gets worse over time if it's not diagnosed and treated. On top of increasing pain, untreated PFPS may incre",PFPS usually gets <em>worse</em> over time if it's not diagnosed <em>and</em> treated.
13,hybrid,10,19.817799,swimming,s40798-016-0051-2.pdf,5516,<!-- image --> aware of physiologic stressors and biomechanics during the swim stroke similar to how we have come to und,-- image --> aware of physiologic stressors <em>and</em> biomechanics during the swim <em>stroke</em> similar to <em>how</em> we
14,knn,1,0.85277164,swimming,s40798-016-0051-2.pdf,5518,Knee Up to 75 % of breaststrokers report medial knee pain . Medial knee pain can occur from strain on the medial collate,
14,knn,2,0.8516705,swimming,applsci-15-01643.pdf,4389,"Freestyle (commonly known as 'crawl') and butterfly strokes pose the highest injury risks among swimming styles, primari",
14,knn,3,0.84446967,swimming,Swimming Overuse Injuries - Physiopedia.pdf,5061,"Knee pain figures range from 34% to 86% for a single knee episode, being highest in breaststrokers, <!-- image --> Knee ",
14,knn,4,0.842271,swimming,applsci-15-01643.pdf,4417,"While the shoulder remains the most injured region among swimmers, this review also underscores the knee and lumbar spin",
14,knn,5,0.8344657,swimming,10.1177_1941738112442132.pdf,4336,"Biomechanical factors affecting knee injuries . Like most swimming pathology, overuse is the primary factor in causing B",
14,knn,6,0.8321505,swimming,fspor-07-1509081.pdf,4970,"Artistic swimmers train their cardiorespiratory capacity by swimming mainly in freestyle, which adds to the repetition o",
14,knn,7,0.82839644,swimming,Injuries_in_swimming_sports_prevention_and_treatme.pdf,5393,Swimming is a unlike sport that mix upper and lower extremity strength exercises with aerobic energy training in a weigh,
14,knn,8,0.8247638,swimming,Injuries_in_swimming_sports_prevention_and_treatme.pdf,5405,In swimmers most common injuries are ocur in shoulder and the second one is happend in knee joint. The prevalence of kne,
14,knn,9,0.8222101,swimming,10.1177_1941738112442132.pdf,4337,"The flutter kick in freestyle swimming requires repetitive quadriceps contraction, which may result in patellofemoral ov",
14,knn,10,0.8167603,swimming,Swimming Overuse Injuries - Physiopedia.pdf,5059,<!-- image --> - Hyperextension of the lumbar spine during freestyle and butterfly - poor kick technique - stress fractu,
14,hybrid,1,25.024616,badminton,Common Badminton Injuries and Their Preventions.pdf,397,"off-loading, ankle and hip forearms flexors, avoid to and braces shoulders and 2 1 for back upper - and a 3:1 maintain c","off-loading, ankle <em>and</em> hip forearms flexors, avoid to <em>and</em> braces shoulders <em>and</em> 2 1 for <em>back</em> upper - <em>and</em>"
14,hybrid,2,24.58179,badminton,Common Badminton Injuries and Their Preventions.pdf,398,"badminton in Managing is played hand bad Rest, Ice, habits that Compress, are <!-- image --> Chronic and harder Elevate)",-- image --> Chronic <em>and</em> harder Elevate) it <em>what</em> to is easy to recover from <em>do</em> at home <em>Protect</em>: <em>The</em> <em>help</em>
14,hybrid,3,21.620964,swimming,10.1177_1941738110377611.pdf,5495,"The arm motion in the breaststroke initially resembles the beginning pull of a butterfly stroke. However, the breaststro","However, <em>the</em> <em>breaststroke</em> pull does not continue with <em>the</em> forearms passing under <em>the</em> <em>body</em> to <em>the</em> level"
14,hybrid,4,20.62401,swimming,applsci-15-01643.pdf,4417,"While the shoulder remains the most injured region among swimmers, this review also underscores the knee and lumbar spin",<em>and</em> valgus stresses <em>on</em> <em>the</em> knee joint .
14,hybrid,5,20.061722,swimming,cdc_225955_DS1.pdf,5291,"Interestingly, stroke specialties other than freestyle were associated with a higher risk for injury. However, our cohor",to particular <em>body</em> <em>parts</em>.
14,hybrid,6,19.669552,swimming,Swimming Overuse Injuries - Physiopedia.pdf,5059,<!-- image --> - Hyperextension of the lumbar spine during freestyle and butterfly - poor kick technique - stress fractu,-- image --> - Hyperextension of <em>the</em> lumbar spine during <em>freestyle</em> <em>and</em> butterfly - poor kick technique
14,hybrid,7,19.385996,running,running-injuries-how-to-prevent-and-overcome.pdf,2532,"At the end of the chapter, the authors underline once more the importance of the psychological aspect: 'Indeed, it is po",In this approach <em>the</em> caregiver needs to understand <em>the</em> patient's psyche <em>and</em> <em>why</em> <em>the</em> patient came to have
14,hybrid,8,19.349007,swimming,"BEAR Implant Comeback Story_ Kyle, Swimming _ Miach Orthopaedics.pdf",4551,Dr. Keyes: When it comes to clinical decision making on when to do a restoration with the BEAR Implant versus choosing A,Keyes: When it comes to clinical decision making <em>on</em> when to <em>do</em> a restoration with <em>the</em> BEAR Implant versus
14,hybrid,9,18.669666,swimming,35 Tips from 35 Swim Coaches.pdf,5999,"For budding swimmers who struggle to do legal breaststroke kick, put flip flop sandals on their feet and have them kick.","For budding swimmers who struggle to <em>do</em> legal <em>breaststroke</em> kick, <em>put</em> flip flop sandals <em>on</em> their feet"
14,hybrid,10,18.646381,badminton,applsci-14-05194.pdf,222,"Badminton involves singles and doubles matches characterized by jumps, lunges, rapid directional changes, and swift arm ",", <em>and</em> swift arm movements, which frequently lead to injuries across various <em>body</em> <em>parts</em> ."
15,knn,1,0.8637532,swimming,s40798-016-0051-2.pdf,5521,Focused Strengthening Exercises Dryland training has been an important part of strengthening programs among swimmers at ,
15,knn,2,0.8635115,swimming,ijspt-10-712.pdf,4646,Forty to ninety-one percent of age group through masters' level swimmers report shoulder pain at some point during their,
15,knn,3,0.8524905,swimming,Injuries_in_swimming_sports_prevention_and_treatme.pdf,5402,"90 percent of swimming performance originates from the upper extremity, and almost all of these injuries occur in the sh",
15,knn,4,0.8507178,swimming,Shoulder Exercises for Swimmers _ U.S. Masters Swimming.pdf,4486,"Many swimmers have missed some amount of time away from the water due to some type of shoulder injury, either minor or s",
15,knn,5,0.84881425,swimming,s40798-016-0051-2.pdf,5522,"Return to Swimming after Injury If the treatment program results in removing the swimmer from the water, then a careful ",
15,knn,6,0.8485292,swimming,Injuries_in_swimming_sports_prevention_and_treatme.pdf,5400,"In addition it is very important to strengthen the shoulder area with rotator cuff exercises (Wanivenhaus et. al., 2012)",
15,knn,7,0.8466141,swimming,Return-to-Swimming-Protocol.pdf,4763,Functional training to include core and lower extremity strengthening PHASE FOUR: week 6 - return to swimming a Progress,
15,knn,8,0.8442693,swimming,ijspt-10-712.pdf,4648,"Swimming specific rehabilitation traditionally focuses on scapular stabilization, 20 core body strength, neuromuscular r",
15,knn,9,0.8433033,swimming,90282-sink-or-swim-clinical-objective-tests-and-measures-associated-with-shoulder-pain-in-swimmers-of-varied-age-levels-of-competition-a-systematic-revi.pdf,5181,"Shoulder pain in swimmers has consistently been noted to interfere with swimming training and competition. In 1993, Mc M",
15,knn,10,0.8419085,swimming,10.1177_1941738112442132.pdf,4346,"As soon as the athlete experiences increased pain, warm-up should be long and slow prior to training with intensity, dis",
15,hybrid,1,25.460508,soccer,The Best Soccer Prehab Exercises For Injury Prevention.pdf,3483,Muscle and tendon injuries are much more common in soccer compared to bone contusions and fractures or joint and ligamen,Muscle and tendon <em>injuries</em> <em>are</em> much more common in soccer compared to bone contusions and fractures <em>or</em>
15,hybrid,2,23.259396,swimming,Swimming Overuse Injuries - Physiopedia.pdf,5053,"Swimming is a great sport enjoyed by all age groups at all levels of ability. It is a unique sport,in that it combines u",<em>Swimmers</em> <em>are</em> unfortunately prone to <em>injuries</em>.
15,hybrid,3,21.602022,swimming,"BEAR Implant Comeback Story_ Kyle, Swimming _ Miach Orthopaedics.pdf",4552,"Kyle: At first, rehab was really hard, especially because I didn't expect it to be as difficult as it was. I didn't know",<em>for</em> me.
15,hybrid,4,21.385181,swimming,s40798-016-0051-2.pdf,5521,Focused Strengthening Exercises Dryland training has been an important part of strengthening programs among swimmers at ,Focused <em>Strengthening</em> <em>Exercises</em> Dryland training has been an important part of <em>strengthening</em> programs
