request_id,mode,rank,score,hit_category,hit_source,hit_id,snippet,highlight
15,hybrid,5,21.096535,badminton,Common Badminton Injuries and Their Preventions.pdf,392,"your (RSI) (also wrist, RSIs are known knee, extremely gradually ' and don like ankle, as RSIs) shoulder common badminto","your (RSI) (also wrist, RSIs <em>are</em> known knee, extremely gradually ' and don like ankle, as RSIs) <em>shoulder</em>"
15,hybrid,6,20.713327,swimming,10.1177_1941738112442132.pdf,4348,Musculoskeletal overuse injuries are a common source of pain in competitive swimmers. Correct stroke technique may help ,Musculoskeletal overuse <em>injuries</em> <em>are</em> a common source of pain in competitive <em>swimmers</em>.
15,hybrid,7,20.493652,swimming,Injuries_in_swimming_sports_prevention_and_treatme.pdf,5399,"Studies have shown that shoulder injuries are inevitable in elite performance, regardless of young or adult swimmers (Ka","Studies have shown that <em>shoulder</em> <em>injuries</em> <em>are</em> inevitable in elite performance, regardless of young <em>or</em>"
15,hybrid,8,20.3965,swimming,s40798-016-0051-2.pdf,5518,Knee Up to 75 % of breaststrokers report medial knee pain . Medial knee pain can occur from strain on the medial collate,"Medial knee pain can occur <em>from</em> strain on <em>the</em> medial collateral ligament, irritation of a medial plica"
15,hybrid,9,20.307562,badminton,Common Badminton Injuries and Their Preventions.pdf,398,"badminton in Managing is played hand bad Rest, Ice, habits that Compress, are <!-- image --> Chronic and harder Elevate)","badminton in Managing is played hand bad Rest, Ice, habits that Compress, <em>are</em> <!"
15,hybrid,10,20.272026,badminton,Common Badminton Injuries and Their Preventions.pdf,399,include: exercises Mobility to improve exercises Flexibility exercises Cross-training to prevent Education on warming Wh,include: <em>exercises</em> Mobility to improve <em>exercises</em> Flexibility <em>exercises</em> Cross-training to prevent Education
16,knn,1,0.8817274,swimming,applsci-15-01643.pdf,4414,"The increased injury risk in female swimmers is influenced by multiple factors, including biomechanics, training load, a",
16,knn,2,0.86060685,swimming,applsci-15-01643.pdf,4413,"The primary finding of this review is the higher incidence of injuries in female swimmers compared to male swimmers, wit",
16,knn,3,0.8534656,swimming,applsci-15-01643.pdf,4386,"Abstract: Swimming is a widely practiced sport with significant physical demands, placing athletes at a considerable ris",
16,knn,4,0.8462181,swimming,nihms-1864697.pdf,4998,This study reveals elevated injury rates among adolescent female swimmers and divers compared to their male counterparts,
16,knn,5,0.83919513,swimming,cdc_225955_DS1.pdf,5293,"In summary, we found interesting injury information regarding a previously poorly understood group: collegiate swimmers.",
16,knn,6,0.8385417,swimming,10.1177_1941738112442132.pdf,4327,"Florian Wanivenhaus, MD, Alice J. S. Fox, MSc, Salma Chaudhury, MD Ph D, and Scott A. Rodeo, MD Context: Competitive swi",
16,knn,7,0.8379502,swimming,cdc_225955_DS1.pdf,5289,"Not surprisingly, practice was the most common activity that led to injury, accounting for nearly 60% of injuries. Appro",
16,knn,8,0.8335631,swimming,s40798-016-0051-2.pdf,5546,"Swimming continues to draw athletes of all ages and competition levels. Traditionally, long hours and frequent practice ",
16,knn,9,0.83004797,swimming,applsci-15-01643.pdf,4420,"This review underscores the high prevalence of injuries in swimmers, with the shoulder being the most frequently affecte",
16,knn,10,0.82852876,swimming,s40798-016-0051-2.pdf,5503,- /C15 Swimming training often consists of frequent weekly practice sessions with long hours. - /C15 Musculoskeletal ove,
16,hybrid,1,27.358486,swimming,35 Tips from 35 Swim Coaches.pdf,6014,I swam in the 60s and coached since 1971 and still going strong at 66. The one thing that I always try to do is learn wh,"The one thing <em>that</em> I always try <em>to</em> <em>do</em> is learn <em>what</em> the latest trends, coaching approaches <em>and</em> technological"
16,hybrid,2,25.744392,running,running - How do I overcome this muscle _ knee pain_ - Physical Fitness Stack Exchange.pdf,2092,"I need some advice on actions to take from here. I want to get in better shape, but my shins/knees seem like they just c","I want <em>to</em> <em>get</em> <em>in</em> better shape, but my shins/knees seem like <em>they</em> just can't keep up right now."
16,hybrid,3,25.177782,swimming,35 Tips from 35 Swim Coaches.pdf,6015,Have your age group swimmers wear socks when they are learning backstroke kick. they should try to kick their socks off ,Have your age group <em>swimmers</em> wear socks when <em>they</em> are learning backstroke kick. <em>they</em> should try <em>to</em> kick
16,hybrid,4,24.61413,running,Knee pain and other running injuries - NHS.pdf,2151,"Running injuries can affect anyone, from experienced runners who push themselves hard, to beginners whose muscles are no","Running injuries <em>can</em> affect anyone, from experienced runners who push themselves hard, <em>to</em> beginners whose"
16,hybrid,5,23.66142,badminton,KNEE_JOINT_REHABILITATION_IN_BADMINTON_ATHLETES.pdf,450,Figure 1. Knee joint injuries of badminton players. <!-- image --> Figure 2. Technical reasons of badminton players' kne,"It <em>can</em> be seen from the data <em>that</em> among the 64 players, 3 players were <em>injured</em> during forehand serve,"
16,hybrid,6,23.302307,swimming,35 Tips from 35 Swim Coaches.pdf,6017,Many years ago there were a lot of different rules. In backstroke you could stand on the gutter when you started. It was,It was easy <em>to</em> really launch yourself into the air <em>and</em> still <em>get</em> into streamline before you entered the
16,hybrid,7,23.29757,soccer,How to prevent common exercise injuries.pdf,4101,"As just mentioned, fatigue is a major risk factor for injury. Sleep deprivation is an almost universally underestimated ","As just mentioned, fatigue is a major <em>risk</em> factor for injury."
16,hybrid,8,23.006691,running,The Path to Healing From A Running Injury _ Injinji®.pdf,2114,"My history with injury goes way back to junior high. When I started track, I was in and out of physical therapy (PT), as","<em>They</em> ordered tests <em>and</em> told me nothing was wrong, <em>and</em> therefore there was no plan except <em>to</em> <em>get</em> a second"
16,hybrid,9,22.192522,soccer,How to prevent common exercise injuries.pdf,4106,"Don't underestimate the importance of prevention ... after you've already been injured! After an injury, you should doub",The <em>risk</em> of re -injury <em>and</em> collateral injury is a significant factor <em>in</em> many cases of chronic pain.
16,hybrid,10,21.672176,swimming,applsci-15-01643.pdf,4414,"The increased injury risk in female swimmers is influenced by multiple factors, including biomechanics, training load, a","The increased injury <em>risk</em> <em>in</em> <em>female</em> <em>swimmers</em> is influenced by multiple factors, including biomechanics"
