request_id,mode,rank,score,hit_category,hit_source,hit_id,snippet,highlight
1,knn,1,0.8870903,badminton,5673-17122-1-PB.pdf,356,"Badminton, as a sport that demands speed, accuracy, and agility, often causes injuries to players. These injuries can re",
1,knn,2,0.8869115,badminton,5673-17122-1-PB.pdf,371,"In this systematic review process, we identified 150 potential studies through electronic database searches and manual r",
1,knn,3,0.8825331,badminton,5673-17122-1-PB.pdf,385,"From this systematic review, it was found that evidence-based approaches in badminton injury rehabilitation play a cruci",
1,knn,4,0.881992,badminton,5673-17122-1-PB.pdf,380,The findings of this systematic review highlight the importance of evidence-based rehabilitation approaches in managing ,
1,knn,5,0.8778028,badminton,5673-17122-1-PB.pdf,376,"In an in-depth exploration of the effectiveness of different injury rehabilitation approaches in badminton, the research",
1,knn,6,0.8769918,badminton,KNEE_JOINT_REHABILITATION_IN_BADMINTON_ATHLETES.pdf,457,"In the sport process of badminton, players need to constantly change their positions according to the actual situation o",
1,knn,7,0.87660724,badminton,fpsyg-13-947877.pdf,252,"Badminton is considered as one of the fastest racket sports (Phomsoupha and Laffaye, 2015; Abdullahi and Coetzee, 2017; ",
1,knn,8,0.8738612,badminton,5673-17122-1-PB.pdf,377,"1. Physical Therapy: Physical therapy, including specialised exercises to improve strength, flexibility, and balance, sh",
1,knn,9,0.8727243,badminton,5673-17122-1-PB.pdf,358,"Badminton, recognized as one of the most popular sports in the world, demands extreme speed, accuracy, and endurance fro",
1,knn,10,0.8718955,badminton,5673-17122-1-PB.pdf,384,The findings of this systematic review pave the way for various future research directions that are important to develop,
1,hybrid,1,25.48721,badminton,5673-17122-1-PB.pdf,384,The findings of this systematic review pave the way for various future research directions that are important to develop,to develop and strengthen the evidence base <em>in</em> <em>badminton</em> injury <em>rehabilitation</em>.
1,hybrid,2,22.93311,badminton,5673-17122-1-PB.pdf,356,"Badminton, as a sport that demands speed, accuracy, and agility, often causes injuries to players. These injuries can re","<em>Badminton</em>, as a sport that demands speed, accuracy, and agility, often causes <em>injuries</em> to <em>players</em>."
1,hybrid,3,22.874605,badminton,KNEE_JOINT_REHABILITATION_IN_BADMINTON_ATHLETES.pdf,440,"Tiejun Zhang Zhengzhou, Henan, China. 450046. zhangtiejun2020@163.com <!-- image --> Original article Artigo origin Al A","common <em>in</em> <em>badminton</em>, and the <em>knee</em> joint is the <em>most</em> affected."
1,hybrid,4,22.798132,badminton,5673-17122-1-PB.pdf,358,"Badminton, recognized as one of the most popular sports in the world, demands extreme speed, accuracy, and endurance fro","<em>Badminton</em>, recognized as one of the <em>most</em> popular sports <em>in</em> the world, demands extreme speed, accuracy"
1,hybrid,5,21.68567,badminton,#1 Injury Prevention Tips for Badminton.pdf,329,- Most Common Badminton Injuries - Tips for badminton injury - Tips to Avoid Strain - Importance of Rest and Stretching ,- <em>Most</em> Common <em>Badminton</em> <em>Injuries</em> - Tips <em>for</em> <em>badminton</em> injury - Tips to Avoid Strain - Importance of Rest
1,hybrid,6,21.526886,badminton,badminton-related-musculoskeletal-injuries-in-senior-players-epidemiology-and-preventive-strategies-15917.pdf,43,"Badminton is a sport that can cause injuries, although most are not caused by body-to-body contact [6, 21]. This may res","<em>Badminton</em> is a sport that can cause <em>injuries</em>, although <em>most</em> <em>are</em> not caused by body-to-body contact [6"
1,hybrid,7,20.514729,badminton,5673-17122-1-PB.pdf,385,"From this systematic review, it was found that evidence-based approaches in badminton injury rehabilitation play a cruci","From this systematic review, it was found that evidence-based approaches <em>in</em> <em>badminton</em> injury <em>rehabilitation</em>"
1,hybrid,8,19.57028,badminton,5673-17122-1-PB.pdf,371,"In this systematic review process, we identified 150 potential studies through electronic database searches and manual r","<em>in</em> <em>badminton</em>, methodological quality, and novelty of data, we screened and selected 26 studies <em>for</em> further"
1,hybrid,9,19.42439,badminton,badminton-related-musculoskeletal-injuries-in-senior-players-epidemiology-and-preventive-strategies-15917.pdf,53,"The strength of this study lies in its large sample size, which includes senior badminton players. However, this study h","The strength of this study lies <em>in</em> its large sample size, which includes senior <em>badminton</em> <em>players</em>."
1,hybrid,10,19.302353,badminton,KNEE_JOINT_REHABILITATION_IN_BADMINTON_ATHLETES.pdf,453,Knee joint injuries can be divided into two categories: chronic knee joint injuries and acute knee joint injuries. Gener,<em>Knee</em> joint <em>injuries</em> can be divided into two categories: chronic <em>knee</em> joint <em>injuries</em> and acute <em>knee</em> joint
2,knn,1,0.8924408,badminton,5673-17122-1-PB.pdf,361,"The importance of understanding and preventing injuries in badminton must be considered, given their impact on player he",
2,knn,2,0.88154495,badminton,bmjsem-10-4.pdf,405,"Objectives As a high- intensity intermittent sport with short and repeated rapid accelerations, decelerations and change",
2,knn,3,0.878016,badminton,Common Badminton Injuries and Their Preventions.pdf,387,- Focuses on common badminton injuries and their prevention strategies. - Discusses the specific injuries commonly seen ,
2,knn,4,0.87797993,badminton,#1 Injury Prevention Tips for Badminton.pdf,330,"Before diving into prevention, let's understand the types of injuries badminton players most frequently encounter.",
2,knn,5,0.8737459,badminton,bmjsem-10-4.pdf,409,"- With the help of knowledge about informative predictors (gender, age, training level, stress and strain parameters, et",
2,knn,6,0.87326074,badminton,badminton-related-musculoskeletal-injuries-in-senior-players-epidemiology-and-preventive-strategies-15917.pdf,50,"To our knowledge, no comprehensive guidelines exist for preventing lower limb injuries in badminton. It was identified s",
2,knn,7,0.8696604,badminton,#1 Injury Prevention Tips for Badminton.pdf,344,Adhering to the best badminton injury prevention advice can cut your risk substantially. These are warming up thoroughly,
2,knn,8,0.8678912,badminton,applsci-14-05194.pdf,208,These injuries not only diminish the performance of elite athletes but also adversely affect the sustained engagement of,
2,knn,9,0.86780274,badminton,InjuryBadmintonPhomsouphaLaffaye2020 (2).pdf,512,- Studies that have reported on eye injuries have determined 460 - the nature of these injuries and the way they occur. ,
2,knn,10,0.8660389,badminton,#1 Injury Prevention Tips for Badminton.pdf,348,"Badminton injuries can be prevalent, but they are preventable. Whether you're starting out with a racket or preparing to",
2,hybrid,1,35.718956,badminton,badminton-related-musculoskeletal-injuries-in-senior-players-epidemiology-and-preventive-strategies-15917.pdf,43,"Badminton is a sport that can cause injuries, although most are not caused by body-to-body contact [6, 21]. This may res","<em>Badminton</em> is a sport that <em>can</em> cause <em>injuries</em>, although <em>most</em> <em>are</em> not caused by body-<em>to</em>-body contact [6"
2,hybrid,2,35.531322,badminton,#1 Injury Prevention Tips for Badminton.pdf,329,- Most Common Badminton Injuries - Tips for badminton injury - Tips to Avoid Strain - Importance of Rest and Stretching ,- <em>Most</em> <em>Common</em> <em>Badminton</em> <em>Injuries</em> - Tips for <em>badminton</em> injury - Tips <em>to</em> Avoid Strain - Importance <em>of</em> Rest
2,hybrid,3,31.116707,badminton,#1 Injury Prevention Tips for Badminton.pdf,328,"Blog April 25, 2025 Tap For Tech Team <!-- image --> Badminton is a thrilling sport that demands speed, agility, and qui","Whether an elite or a weekend <em>player</em>, <em>the</em> thrill <em>of</em> <em>the</em> game is unparalleled."
2,hybrid,4,29.319761,badminton,badminton-related-musculoskeletal-injuries-in-senior-players-epidemiology-and-preventive-strategies-15917.pdf,53,"The strength of this study lies in its large sample size, which includes senior badminton players. However, this study h","<em>The</em> strength <em>of</em> this study lies <em>in</em> its large sample size, which includes senior <em>badminton</em> <em>players</em>."
2,hybrid,5,29.079498,soccer,The Best Soccer Prehab Exercises For Injury Prevention.pdf,3489,The gold standard for the quadriceps is the Reverse Nordic Hamstring Curl demonstrated above as it has been shown to imp,Keys <em>To</em> Preventing Soccer <em>Injuries</em> This is a great introduction <em>to</em> <em>the</em> <em>most</em> <em>common</em> soccer prehab exercises
2,hybrid,6,28.842346,soccer,52836.pdf,3436,"Understanding the most common injuries in soccer, their causes, and prevention strategies is essential for protecting at","Understanding <em>the</em> <em>most</em> <em>common</em> <em>injuries</em> <em>in</em> soccer, their causes, <em>and</em> prevention <em>strategies</em> is essential"
2,hybrid,7,28.438776,soccer,577.full.pdf,4060,The coach -especially at lower levels -has been identi /uni FB01 ed as the key instigator in performing injury preventio,<em>The</em> countrywide campaign <em>in</em> Switzerland was <em>the</em> /uni FB01 rst example <em>to</em> successfully disseminate <em>and</em>
2,hybrid,8,28.294819,badminton,How Physiotherapy Helps With Badminton Injuries.pdf,169,"Ankle sprains are the most common injuries among badminton players, occurring when the ligaments in the ankle are overst","Ankle sprains <em>are</em> <em>the</em> <em>most</em> <em>common</em> <em>injuries</em> <em>among</em> <em>badminton</em> <em>players</em>, occurring when <em>the</em> ligaments <em>in</em> <em>the</em>"
2,hybrid,9,27.686195,badminton,badminton-related-musculoskeletal-injuries-in-senior-players-epidemiology-and-preventive-strategies-15917.pdf,44,"The epidemiology of badminton injuries is not well documented and there is a lack of data in Thailand, particularly amon",<em>The</em> epidemiology <em>of</em> <em>badminton</em> <em>injuries</em> is not well documented <em>and</em> there is a lack <em>of</em> data <em>in</em> Thailand
2,hybrid,10,27.353704,badminton,5673-17122-1-PB.pdf,358,"Badminton, recognized as one of the most popular sports in the world, demands extreme speed, accuracy, and endurance fro","<em>Badminton</em>, recognized as one <em>of</em> <em>the</em> <em>most</em> popular sports <em>in</em> <em>the</em> world, demands extreme speed, accuracy"
3,knn,1,0.8692587,badminton,5673-17122-1-PB.pdf,377,"1. Physical Therapy: Physical therapy, including specialised exercises to improve strength, flexibility, and balance, sh",
3,knn,2,0.86403936,badminton,5673-17122-1-PB.pdf,385,"From this systematic review, it was found that evidence-based approaches in badminton injury rehabilitation play a cruci",
3,knn,3,0.8639386,badminton,5673-17122-1-PB.pdf,380,The findings of this systematic review highlight the importance of evidence-based rehabilitation approaches in managing ,
3,knn,4,0.8635422,badminton,5673-17122-1-PB.pdf,356,"Badminton, as a sport that demands speed, accuracy, and agility, often causes injuries to players. These injuries can re",
3,knn,5,0.8570129,badminton,5673-17122-1-PB.pdf,371,"In this systematic review process, we identified 150 potential studies through electronic database searches and manual r",
3,knn,6,0.85695565,badminton,5673-17122-1-PB.pdf,358,"Badminton, recognized as one of the most popular sports in the world, demands extreme speed, accuracy, and endurance fro",
3,knn,7,0.85531473,badminton,applsci-14-05194.pdf,208,These injuries not only diminish the performance of elite athletes but also adversely affect the sustained engagement of,
3,knn,8,0.8543288,badminton,applsci-14-05194.pdf,223,"The most frequently injured body tissues during both competition and training are muscles, ligaments, and tendons. Hy et",
3,knn,9,0.8509005,badminton,5673-17122-1-PB.pdf,360,Types of Injuries: Injuries in badminton are common due to the high intensity and repetitive movements demanded by the s,
3,knn,10,0.84921926,badminton,#1 Injury Prevention Tips for Badminton.pdf,331,"1. Ankle Sprains : One of the most prevalent badminton injuries, ankle sprains are caused by sudden direction changes or",
3,hybrid,1,25.401993,soccer,ijerph-19-13237.pdf,3794,"implementation of the rotation strategy and post-match recovery strategy by the teams , as well as the self-adjustment o","implementation <em>of</em> <em>the</em> rotation strategy <em>and</em> post-match <em>recovery</em> strategy by <em>the</em> teams , as well as <em>the</em>"
3,hybrid,2,23.435913,badminton,#1 Injury Prevention Tips for Badminton.pdf,331,"1. Ankle Sprains : One of the most prevalent badminton injuries, ankle sprains are caused by sudden direction changes or","Ankle Sprains : One <em>of</em> <em>the</em> most prevalent <em>badminton</em> <em>injuries</em>, ankle sprains <em>are</em> caused by sudden direction"
3,hybrid,3,23.160507,badminton,5673-17122-1-PB.pdf,371,"In this systematic review process, we identified 150 potential studies through electronic database searches and manual r","<em>After</em> applying strict inclusion <em>and</em> exclusion criteria, including relevance to <em>the</em> topic <em>of</em> injury rehabilitation"
3,hybrid,4,22.931013,badminton,5673-17122-1-PB.pdf,375,"In conclusion, the researcher's findings suggest that there is no single, one-size-fits-all approach to badminton injury","In conclusion, <em>the</em> researcher's findings suggest <em>that</em> there is no single, one-size-fits-all approach"
3,hybrid,5,22.364573,badminton,#1 Injury Prevention Tips for Badminton.pdf,329,- Most Common Badminton Injuries - Tips for badminton injury - Tips to Avoid Strain - Importance of Rest and Stretching ,- Most <em>Common</em> <em>Badminton</em> <em>Injuries</em> - Tips for <em>badminton</em> injury - Tips to Avoid Strain - Importance <em>of</em> Rest
3,hybrid,6,22.272457,soccer,jcm-14-01714.pdf,4046,Future studies should incorporate follow-up assessments beyond the immediate intervention phase to determine whether the,whether <em>the</em> protective effects <em>of</em> NMT <em>are</em> sustained over <em>time</em>.
3,hybrid,7,21.700237,badminton,KNEE_JOINT_REHABILITATION_IN_BADMINTON_ATHLETES.pdf,444,"In the development of modern sports, the competitiveness of sports becomes stronger and the competition becomes more fie","<em>And</em> among <em>the</em> types <em>of</em> <em>injuries</em> <em>of</em> <em>badminton</em> <em>players</em>, knee joint sports <em>injuries</em> <em>are</em> also more <em>common</em>"
3,hybrid,8,20.844393,badminton,badminton-related-musculoskeletal-injuries-in-senior-players-epidemiology-and-preventive-strategies-15917.pdf,40,"In participants who experienced badminton-related injuries in the past year, the majority of injuries were nontraumatic ","In participants who experienced <em>badminton</em>-related <em>injuries</em> in <em>the</em> past year, <em>the</em> majority <em>of</em> <em>injuries</em>"
3,hybrid,9,20.181221,badminton,5673-17122-1-PB.pdf,356,"Badminton, as a sport that demands speed, accuracy, and agility, often causes injuries to players. These injuries can re","<em>Badminton</em>, as a sport <em>that</em> demands speed, accuracy, <em>and</em> agility, often causes <em>injuries</em> to <em>players</em>."
3,hybrid,10,20.080296,badminton,applsci-14-05194.pdf,223,"The most frequently injured body tissues during both competition and training are muscles, ligaments, and tendons. Hy et",Hy et al. examined 2620 <em>badminton</em> <em>players</em> with an average age <em>of</em> 31 years <em>and</em> reported <em>that</em> <em>the</em> most
4,knn,1,0.8033123,cycling,OAJSM-136653-potential-determinants-of-knee-pain-in-cyclists--a-systemati_052218.pdf,934,Different types of studies have been conducted to assess the possible reasons for pain and injuries due to cycling. For ,
4,knn,2,0.8011609,cycling,OAJSM-136653-potential-determinants-of-knee-pain-in-cyclists--a-systemati_052218.pdf,932,"Correspondence: Rodrigo Rico Bini La Trobe Rural Health School, La Trobe University, Flora Hill Campus, Bendigo, VIC 355",
4,knn,3,0.79336584,cycling,OAJSM-136653-potential-determinants-of-knee-pain-in-cyclists--a-systemati_052218.pdf,935,Our study aimed to assess the potential factors associated with overuse knee-related pain and/or injuries in cyclists us,
4,knn,4,0.7917306,cycling,OAJSM-136653-potential-determinants-of-knee-pain-in-cyclists--a-systemati_052218.pdf,962,"Expanding the horizon of overuse (non-traumatic) injuries in cycling, Dettori and Norvel 11 indicated that only a few of",
4,knn,5,0.79107887,cycling,14-Borgers_et_al..pdf,878,Competitive cycling is a very demanding sport with cyclists training and racing for multiple hours at high velocity and ,
4,knn,6,0.7904639,cycling,Potential_factors_associated_with_knee_pain_in_cyc.pdf,1313,"Expanding the horizon of overuse (non-traumatic) injuries in cycling, Dettori and Norvel 11 indicated that only a few of",
4,knn,7,0.788831,cycling,846ec41411ce064c25fb6a549c054a7297ec.pdf,1384,Background: The knee is susceptible to injury during cycling due to the repetitive nature of the activity while generati,
4,knn,8,0.78795016,cycling,846ec41411ce064c25fb6a549c054a7297ec.pdf,1402,"In the articles in this systemic review, no issues specific to the posterior knee were discussed. Elmer et al. 26 report",
4,knn,9,0.7879245,cycling,14-Borgers_et_al..pdf,879,"2 Department of Orthopedic Surgery, University Hospitals Leuven, Leuven, Belgium. Correspondence : Anton Borgers, Univer",
4,knn,10,0.78513193,cycling,OAJSM-136653-potential-determinants-of-knee-pain-in-cyclists--a-systemati_052218.pdf,946,This systematic review of the literature intended to assess the potential factors associated with overuse knee injuries ,
4,hybrid,1,22.397635,swimming,Swimming Overuse Injuries - Physiopedia.pdf,5060,"- Correction of muscle imbalances (such as tight hip flexors, weak glutes and core) - optimization of pelvic and joint m","injuries including those of <em>the</em> <em>low</em> <em>back</em> (especially important <em>in</em> <em>the</em> breaststroke <em>and</em> butterfly, <em>the</em>"
4,hybrid,2,20.818888,cycling,OAJSM-136653-potential-determinants-of-knee-pain-in-cyclists--a-systemati_052218.pdf,934,Different types of studies have been conducted to assess the possible reasons for pain and injuries due to cycling. For ,Different types of studies have been conducted to assess <em>the</em> possible reasons <em>for</em> <em>pain</em> <em>and</em> injuries due
4,hybrid,3,20.64102,cycling,OAJSM-136653-potential-determinants-of-knee-pain-in-cyclists--a-systemati_052218.pdf,932,"Correspondence: Rodrigo Rico Bini La Trobe Rural Health School, La Trobe University, Flora Hill Campus, Bendigo, VIC 355",-- image --> Abstract: <em>The</em> potential <em>factors</em> associated with overuse injuries <em>and</em> <em>pain</em> <em>in</em> <em>cyclists</em> that
4,hybrid,4,20.530876,cycling,14-Borgers_et_al..pdf,878,Competitive cycling is a very demanding sport with cyclists training and racing for multiple hours at high velocity and ,Competitive cycling is a very demanding sport with <em>cyclists</em> training <em>and</em> racing <em>for</em> multiple hours at
4,hybrid,5,18.642254,cycling,THE INFLUENCE OF EXTRINSIC FACTORS ON KNEE BIOMECHANICS DURING CYCLING_ A SYSTEMATIC REVIEW OF THE LITERATURE - PMC.pdf,1126,"With the increase in recreational and competitive cycling, cyclists are experiencing more overuse injuries related to re","With <em>the</em> increase <em>in</em> recreational <em>and</em> competitive cycling, <em>cyclists</em> are experiencing more overuse injuries"
4,hybrid,6,18.642254,cycling,846ec41411ce064c25fb6a549c054a7297ec.pdf,1386,"With the increase in recreational and competitive cycling, cyclists are experiencing more overuse injuries related to re","With <em>the</em> increase <em>in</em> recreational <em>and</em> competitive cycling, <em>cyclists</em> are experiencing more overuse injuries"
4,hybrid,7,18.372545,cycling,846ec41411ce064c25fb6a549c054a7297ec.pdf,1384,Background: The knee is susceptible to injury during cycling due to the repetitive nature of the activity while generati,"Knee <em>pain</em> is <em>the</em> most common overuse related injury reported <em>by</em> <em>cyclists</em>, <em>and</em> intrinsic <em>and</em> extrinsic"
4,hybrid,8,17.847094,cycling,14-Borgers_et_al..pdf,879,"2 Department of Orthopedic Surgery, University Hospitals Leuven, Leuven, Belgium. Correspondence : Anton Borgers, Univer",knee injuries were <em>the</em> second most common injury (18%) <em>and</em> <em>the</em> main cause of total days lost <em>for</em> training
4,hybrid,9,17.749664,swimming,10.1177_1941738112442132.pdf,4339,"Muscle strength, endurance, and flexibility protect against low back pain and/or injuries. Mechanical loading of the spi","Muscle strength, endurance, <em>and</em> flexibility protect against <em>low</em> <em>back</em> <em>pain</em> <em>and</em>/or injuries."
4,hybrid,10,16.579508,badminton,STUDY_ON_SPORTS_INJURIES_AND_REHABILITATION_IN_BAD.pdf,229,"Xiaofeng Wang Shijiazhuang, Hebei, China. 050000. fbo1129@163.com <!-- image --> Introduction: Badminton has a wide audi",-- image --> Introduction: Badminton has a wide audience <em>and</em> a large development market <em>in</em> China.
5,knn,1,0.82448685,cycling,RossM_TrySportsReferenceGuide.pdf,1689,"Saddle height affects hip, ankle and knee movements during cycling. 25 - 4-5% change in saddle height results in a 25% c",
5,knn,2,0.8179153,cycling,OAJSM-136653-potential-determinants-of-knee-pain-in-cyclists--a-systemati_052218.pdf,947,"An alternative scenario would involve a differential activation of hip adductor (e.g., adductor magnus) and hip external",
5,knn,3,0.8169572,cycling,Potential_factors_associated_with_knee_pain_in_cyc.pdf,1298,"An alternative scenario would involve a differential activation of hip adductor (e.g., adductor magnus) and hip external",
5,knn,4,0.8155245,cycling,Potential_factors_associated_with_knee_pain_in_cyc.pdf,1313,"Expanding the horizon of overuse (non-traumatic) injuries in cycling, Dettori and Norvel 11 indicated that only a few of",
5,knn,5,0.8152929,cycling,OAJSM-136653-potential-determinants-of-knee-pain-in-cyclists--a-systemati_052218.pdf,962,"Expanding the horizon of overuse (non-traumatic) injuries in cycling, Dettori and Norvel 11 indicated that only a few of",
5,knn,6,0.79987353,cycling,846ec41411ce064c25fb6a549c054a7297ec.pdf,1386,"With the increase in recreational and competitive cycling, cyclists are experiencing more overuse injuries related to re",
5,knn,7,0.79958427,cycling,THE INFLUENCE OF EXTRINSIC FACTORS ON KNEE BIOMECHANICS DURING CYCLING_ A SYSTEMATIC REVIEW OF THE LITERATURE - PMC.pdf,1126,"With the increase in recreational and competitive cycling, cyclists are experiencing more overuse injuries related to re",
5,knn,8,0.79770815,cycling,OAJSM-136653-potential-determinants-of-knee-pain-in-cyclists--a-systemati_052218.pdf,961,"Note: When full text was unavailable. Abbreviations: PFC, patellofemoral compressive; ROM, range of motion; RPE, rate of",
5,knn,9,0.7955166,cycling,(PDF) Cycling Injuries of the Lower Extremity.pdf,1262,"The knee is the most common site of overuse injury in the cyclist, with an estimated 40% to 60% of riders experiencing k",
5,knn,10,0.7932341,cycling,bike-set-up-biomechanics-and-knee-pain.pdf,874,"Ok so now you have your bike set up just right, so problems solved? Not quite, the correct loading and tracking of the k",
5,hybrid,1,23.26906,cycling,Potential_factors_associated_with_knee_pain_in_cyc.pdf,1313,"Expanding the horizon of overuse (non-traumatic) injuries in cycling, Dettori and Norvel 11 indicated that only a few of","Expanding the horizon of <em>overuse</em> (non-traumatic) <em>injuries</em> in cycling, Dettori <em>and</em> Norvel 11 indicated"
5,hybrid,2,22.817812,cycling,OAJSM-136653-potential-determinants-of-knee-pain-in-cyclists--a-systemati_052218.pdf,962,"Expanding the horizon of overuse (non-traumatic) injuries in cycling, Dettori and Norvel 11 indicated that only a few of","Expanding the horizon of <em>overuse</em> (non-traumatic) <em>injuries</em> in cycling, Dettori <em>and</em> Norvel 11 indicated"
5,hybrid,3,20.682522,cycling,Potential_factors_associated_with_knee_pain_in_cyc.pdf,1298,"An alternative scenario would involve a differential activation of hip adductor (e.g., adductor magnus) and hip external",) leads <em>to</em> an increased activation of <em>hip</em> adductors <em>and</em> larger forces applied <em>to</em> the pedals. 30 Interestingly
5,hybrid,4,20.209478,cycling,OAJSM-136653-potential-determinants-of-knee-pain-in-cyclists--a-systemati_052218.pdf,947,"An alternative scenario would involve a differential activation of hip adductor (e.g., adductor magnus) and hip external",) leads <em>to</em> an increased activation of <em>hip</em> adductors <em>and</em> larger forces applied <em>to</em> the pedals. 30 Interestingly
5,hybrid,5,19.430162,cycling,THE INFLUENCE OF EXTRINSIC FACTORS ON KNEE BIOMECHANICS DURING CYCLING_ A SYSTEMATIC REVIEW OF THE LITERATURE - PMC.pdf,1149,compressive forces. The findings of the studies in this systematic review and earlier studies have implications for load,"of the <em>knee</em> joint during cycling <em>and</em> suggest that lower cadences, lower workloads, a higher <em>saddle</em> <em>height</em>"
